{"ts":"2026-10-16T20:58:38.434Z","event":"exchange","trace_id":"4bf92f3577b34da6a3ce929d0e0e4736","space":"acme","airlock":"hr","revision":"7b2280eab4b5","user":"eric@example.com","client":"acme-chat","question":"What is my gross salary?","answer":"Your gross salary is 78,000 EUR.","outcome":"answered","reason":null,"tools":[{"name":"read_my_records","args":{"entity":"hr.compensation"},"data_source":"hr","rows":1,"rule_version":"v1.7b2280eab4b5","sql_hash":"3f9a1c0d2b7e","rows_hash":"5c1e9b0a4d7f2e8c3b6a1d0f9e8c7b6a5d4c3b2a1f0e9d8c7b6a5f4e3d2c1b0a","error":null}],"evidence":["ev-1"],"verifiers":[{"name":"FigureVerifier","verdict":"PASS"}],"figures":{"sourced":1,"computed":0,"unsourced":0,"mismatch":0},"grounding":{"segments":[{"text":"Your gross salary is "},{"figure":"f1"},{"text":"."}],"figures":[{"id":"f1","display":"78,000 EUR","status":"sourced","source":{"evidence":"ev-1","entity":"hr.compensation","column":"gross_salary","row_key":"3"}}],"tables":[],"quotes":[]},"model":{"provider":"ollama","name":"qwen3.6:27b-q4_K_M","calls":2,"input_tokens":1840,"output_tokens":212},"duration_ms":6114}
